{
  "schema_version": 2,
  "simulation": {
    "recipe": {
      "layer_height_um": 50.0,
      "bottom_layer_count": 6,
      "transition_layers": 3,
      "normal_exposure_sec": 2.5,
      "bottom_exposure_sec": 25.0,
      "wait_before_cure_sec": 0.5,
      "wait_before_release_sec": 1.0,
      "wait_after_release_sec": 0.0,
      "lift_speed_mm_min": 60.0,
      "lift_cycle_sec": 7.5,
      "lift_distance_mm": 5.0,
      "retract_speed_mm_min": null
    },
    "printer": {
      "name": "Generic MSLA 4K",
      "led_power_mw_cm2": 4.0,
      "pixel_pitch_um": 50.0,
      "layer_height_range_um": {
        "min": 20.0,
        "max": 100.0
      },
      "exposure_range_sec": {
        "min": 1.0,
        "max": 60.0
      },
      "lift_speed_range_mm_min": {
        "min": 10.0,
        "max": 200.0
      },
      "bottom_layer_count_max": 15,
      "z_stiffness_n_per_mm": 460.0,
      "delta_t_steady_c": 10.0,
      "thermal_tau_sec": 1200.0,
      "lcd_uniformity_variation": 0.22,
      "voxel_size_mm": 0.5,
      "release_mechanism": "linear",
      "led_delta_t_steady_c": 10.0,
      "led_tau_sec": 1200.0,
      "led_to_vat_coupling": 0.5,
      "build_envelope_mm": {
        "width_mm": 192.0,
        "depth_mm": 120.0,
        "max_z_mm": 200.0
      },
      "voxel_cure_resolution_mm": null,
      "crosstalk_sigma_xy_um": null,
      "crosstalk_sigma_z_um": null,
      "convective_wall_h_w_m2k": 8.0,
      "vat_wall_thickness_mm": 2.0,
      "vat_wall_k_w_mk": 200.0,
      "vacuum_pressure_kpa": null
    },
    "layers": [
      {
        "index": 0,
        "cure_depth_um": 100.0,
        "peel_force_n": 1.5,
        "suction_force_n": 0.0,
        "base_force_n": 0.0,
        "total_force_n": 1.5,
        "support_capacity_n": 30.0,
        "safety_factor": 20.0,
        "cross_section_area_mm2": 100.0,
        "area_delta_mm2": 0.0,
        "vat_temperature_c": 22.0,
        "viscosity_mpa_s": 200.0,
        "z_deflection_um": 2.0,
        "effective_layer_height_um": 48.0,
        "worst_cure_depth_um": 100.0
      }
    ],
    "failures": []
  },
  "provenance": {
    "input_path": "fixtures/synthetic.ctb",
    "resin_name": "Generic Standard",
    "printer_name": "Generic MSLA 4K",
    "n_supports": 20,
    "tip_radius_mm": 0.2
  },
  "cure_kinetics_ea_is_default": false
}